{
 "schema_version": 2,
 "updated_at": "2026-10-23T01:29:39.675414Z",
 "map": {
  "AdamPlatin123/awesome-dsh-plugins": "agent",
  "ATH-MaaS/Pixelle-Video": "video",
  "deepseek-ai/deepseek-harness": "agent",
  "KKKKhazix/khazix-skills": "agent",
  "HKUDS/DeepTutor": "learning",
  "ChenShuo2004/cs-skills": "agent",
  "worenbudaoni/rag-study-helper": "learning",
  "ayi-ai/nie-grassroots-logic": "distill",
  "ruanyf/weekly": "learning",
  "wendy7756/AI-Video-Transcriber": "tools",
  "kangarooking/kangarooking-skills": "agent",
  "CY-CHENYUE/wechat-typesetting-cy": "content",
  "ace3000chao/book2startup": "distill",
  "MLNLP-World/LLMs-from-scratch-CN": "learning",
  "nuwax-ai/nuwax": "assistant",
  "ghoustghoust/style-still.skill": "distill",
  "esengine/DeepSeek-Reasonix": "coding",
  "zhaoxuya520/reverse-skill": "tools",
  "xdash/FDE-the-Guidance-Book-of-Forward-Deployed-Engineer": "learning",
  "AragornZJF/skill-tools": "agent",
  "tashfeenahmed/freellmapi": "coding",
  "Lordog/dive-into-llms": "learning",
  "alchaincyf/nuwa-skill": "distill",
  "Yeadon8888/cangjie-skill": "distill",
  "justinhuangai/first-principles-skill": "distill",
  "chuspeeism/dashi-ppt-skill": "content",
  "fishjar/kiss-translator": "tools",
  "Vincentwei1021/video-shotcraft": "video",
  "hugohe3/ppt-master": "content",
  "Thysrael/Horizon": "assistant",
  "tirth8205/code-review-graph": "coding",
  "bojieli/ai-agent-book": "learning",
  "AstrBotDevs/AstrBot": "assistant",
  "rohitg00/ai-engineering-from-scratch": "learning",
  "xhongc/ai_story": "video",
  "mattpocock/skills": "agent",
  "521xueweihan/HelloGitHub": "learning",
  "Kwei168/tvbox": "tools",
  "NanmiCoder/MediaCrawler": "tools",
  "dramaclaw/dramaclaw": "video",
  "crmeb/CRMEB": "tools",
  "llazyl/TVBox": "tools",
  "q215613905/TVBoxOS": "tools",
  "FongMi/TV": "tools",
  "RiTian96/SurfHelper": "tools",
  "HKUDS/VideoAgent": "video",
  "kangarooking/cangjie-skill": "distill",
  "github/spec-kit": "agent",
  "Tencent/workrally": "video",
  "ltaoo/wx_channels_download": "tools",
  "Forget-C/Jellyfish": "video",
  "chatfire-AI/huobao-drama": "video",
  "isjiamu/jiamu-skills": "agent",
  "isjiamu/gzh-design-skill": "content",
  "tiantianGPU/reg-factory": "tools",
  "keyuyuan/skillhub-awesome-skills": "agent",
  "jnMetaCode/ai-coding-guide": "learning",
  "alchaincyf/huasheng_editor": "content",
  "qiye45/wechatDownload": "tools",
  "ngo5/IPTV": "tools",
  "noimank/tvbox": "tools",
  "hehonghui/simple-iptv": "tools",
  "fish2018/pansou": "tools",
  "alchaincyf/huashu-design": "content",
  "VoltAgent/awesome-design-md": "frontend",
  "agentscope-ai/QwenPaw": "assistant",
  "dtsola/xiaoyaosearch-feishu-export-md": "tools",
  "calesthio/OpenMontage": "video",
  "addyosmani/agent-skills": "agent",
  "opensquilla/opensquilla": "assistant",
  "msitarzewski/agency-agents": "agent",
  "XiaomiMiMo/MiMo-Code": "coding",
  "freestylefly/tianyancha-skill": "tools",
  "iOfficeAI/OfficeCLI": "coding",
  "lulin70/OPC-Agents": "business",
  "mvanhorn/last30days-skill": "agent",
  "c1028874817-beep/openclaw-skill-ai-daily-report": "business",
  "golngod/OPC-Skills": "business",
  "liaosong0187765-maker/opc-skills": "business",
  "zhenhaolee010318-sketch/xhs-opc": "business",
  "himeai/opc-skills-cn": "business",
  "iamtouchskyer/opc": "business",
  "Wei-Shaw/sub2api": "coding",
  "NanmiCoder/cc-haha": "assistant",
  "vercel-labs/skills": "agent",
  "vercel-labs/agent-skills": "agent",
  "freestylefly/canghe-skills": "agent",
  "op7418/guizang-ppt-skill": "content",
  "na57/chinese-copyright-application-skill": "business",
  "jnMetaCode/superpowers-zh": "agent",
  "Fokkyp/SoftwareCopyright-Skill": "business",
  "handsomestWei/patent-disclosure-skill": "business",
  "DMNO1/legal-compliance-skill-bundle": "business",
  "Mark1017520/china-internet-compliance-codex-skills": "business",
  "ShadowGaoxing/tom-hr-skill": "business",
  "liucunguang/agency-agents-zh": "agent",
  "iniwap/AIWriteX": "content",
  "nexu-io/open-design": "frontend",
  "JimLiu/baoyu-design": "frontend",
  "maboloshi/github-chinese": "tools",
  "AIEraDev/Clypra": "video",
  "TauricResearch/TradingAgents": "finance",
  "danny-avila/LibreChat": "assistant",
  "Fincept-Corporation/FinceptTerminal": "finance",
  "heygen-com/hyperframes": "video",
  "harry0703/MoneyPrinterTurbo": "video",
  "alirezarezvani/claude-skills": "agent",
  "chenhg5/cc-connect": "coding",
  "react/react": "frontend",
  "freestylefly/CodexGuide": "learning",
  "freestylefly/wesight": "assistant",
  "alchaincyf/huashu-skills": "content",
  "wechat-article/wxdown-service": "tools",
  "affaan-m/ECC": "agent",
  "eternityspring/shuohao-skills": "video",
  "HBAI-Ltd/Toonflow-app": "video",
  "zhongerxin/Cowart": "video",
  "frappe/hrms": "agent",
  "ourongxing/newsnow": "agent",
  "webadderallorg/Recordly": "video",
  "getopenscreen/openscreen": "tools",
  "NanmiCoder/dsh-auto-mode": "tools",
  "ddcat-ai/open-ai-canvas": "video",
  "chatfire-AI/huobao-canvas": "video",
  "basketikun/infinite-canvas": "video",
  "tigerowo/infinite-canvas": "video",
  "anymouschina/TapCanvas": "video",
  "hero8152/Infinite-Canvas": "video",
  "iBlinkQ/project-cairn": "agent",
  "88lin/video_vip": "video",
  "666ghj/BettaFish": "learning",
  "5ime/bilibili-API-collect": "agent",
  "MakcRe/KuGouMusicApi": "agent",
  "d2l-ai/d2l-zh": "learning",
  "RapidAI/RapidOCR": "agent",
  "PlexPt/awesome-chatgpt-prompts-zh": "learning",
  "hiroi-sora/Umi-OCR": "video",
  "popopo-99/zy-cinematic-realism": "agent",
  "powerycy/goutoujunshi": "agent",
  "alibaba/page-agent": "agent",
  "AlephAITech/WorkBuddyGuide": "learning",
  "kanadeblisst00/WechatVideoSniffer2.0": "tools",
  "guoyue2010/lxmusic-": "agent",
  "UnblockNeteaseMusic/server": "agent",
  "NeteaseCloudMusicApiEnhanced/api-enhanced": "agent",
  "aishwaryanr/awesome-generative-ai-guide": "learning",
  "Lightricks/LTX-2": "video",
  "lzhgus/cc-plugin-codex": "agent",
  "openai/codex-plugin-cc": "agent",
  "lanxiuyun/Catrace": "assistant",
  "XxHuberrr/Mineradio": "agent",
  "fancyboi999/ai-engineering-from-scratch-zh": "tools",
  "mistydew/tokenicode-deepseek-alpha": "learning",
  "bozhouDev/codex-orange-book": "tools",
  "GitHubDaily/GitHubDaily": "frontend",
  "Lling0000/Vibe_coding_guide": "learning",
  "zhukunpenglinyutong/desktop-cc-gui": "content",
  "yizhiyanhua-ai/fireworks-tech-graph": "agent",
  "Ronchy2000/epic-freebies-helper": "learning",
  "PDFMathTranslate-next/PDFMathTranslate-next": "tools",
  "Haleclipse/CCometixLine": "agent",
  "ztx888/HaloWebUI": "tools",
  "VoltAgent/awesome-agent-skills": "agent",
  "antfu/skills": "agent",
  "composio-community/skills": "agent",
  "muratcankoylan/Agent-Skills-for-Context-Engineering": "agent",
  "OthmanAdi/planning-with-files": "coding",
  "anthropics/skills": "agent",
  "SuperClaude-Org/SuperClaude_Framework": "agent",
  "obra/superpowers": "distill",
  "1EchA/how-to-vibecoding": "learning",
  "mindfold-ai/Trellis": "coding",
  "DavidHDev/react-bits": "frontend",
  "Panniantong/Agent-Reach": "tools",
  "shadcn-ui/ui": "frontend",
  "BigPizzaV3/CodexPlusPlus": "agent",
  "anghunk/linuxdo-scripts": "agent",
  "javaht/claude-desktop-zh-cn": "assistant",
  "farion1231/cc-switch": "assistant",
  "tauri-apps/tauri": "frontend",
  "op7418/guizang-social-card-skill": "content",
  "Kwei168/superpowers-zh": "tools",
  "YD4223/aihub": "assistant",
  "Jermic/awesome-aiart-pics-prompts": "content",
  "dogxii/60s-web": "agent",
  "multica-ai/multica": "coding",
  "tinyhumansai/openhuman": "learning",
  "Lynpoint/CyberVerse": "tools",
  "jiellll1219/OpenDoctoratePy-EX-Public": "agent",
  "yaobiao131/downkyicore": "tools",
  "lixibi/browser-use": "agent",
  "dadaguailhb/TCL": "agent",
  "Hy-U1free/TapCanvas": "video",
  "whiteguo233/OpenBiliClaw": "tools",
  "awesome-dsh-plugin/awesome-dsh-plugin": "learning",
  "huangmingche/first-principles-skill": "distill",
  "rachelos/we-mp-rss": "tools",
  "Ascotbe/HackerMind": "learning",
  "0xsline/awesome-deepseek-harness": "coding",
  "guillaumemeyer/watermarks-remover": "content",
  "Accio-org/RealReplicaBench": "agent",
  "alchaincyf/darwin-skill": "agent",
  "ZhuLinsen/daily_stock_analysis": "finance",
  "liustack/modlens": "coding",
  "usestrix/strix": "agent",
  "cactus-compute/needle": "agent",
  "freestylefly/awesome-gpt-image-2": "assistant",
  "slavingia/skills": "agent",
  "Weikezi-AI/video-catcher": "tools",
  "Weikezi-AI/music-dance-video": "video",
  "sherlock-project/sherlock": "agent",
  "akitaonrails/ai-memory": "coding",
  "santifer/career-ops": "coding",
  "volcengine/OpenViking": "agent",
  "mukul975/Anthropic-Cybersecurity-Skills": "agent",
  "wess09/DeepSeekHarnessDesktop": "assistant",
  "vibrantlabsai/ragas": "agent",
  "ghoustghoust/douyin-creator-toolkit": "agent",
  "Accio-org/CommerceAgentBench": "agent",
  "harry0703/MangoDisk": "assistant",
  "WecomTeam/wecom-cli": "agent",
  "anywhere-labs/deepseek-harness-desktop": "assistant",
  "vinhhien112/img2obj": "agent",
  "mingchen666/Reviva": "learning",
  "pireel/pireel": "video",
  "baidu/Unlimited-OCR": "video",
  "kadevin/ilab-conjure": "agent",
  "zchentest/hotboarduapi": "agent",
  "hmjz100/LinkSwift": "tools",
  "fufankeji/deepseek-harness-studio": "assistant",
  "fufankeji/LLMs-Technology-Community-Beyondata": "learning",
  "openai/codex": "coding",
  "Evil0ctal/Douyin_TikTok_Download_API": "tools",
  "doocs/md": "content",
  "Narcooo/inkos": "video",
  "muhammadsami987123/muhammad-sami-dev": "frontend",
  "datawhalechina/hello-agents": "learning",
  "multica-ai/andrej-karpathy-skills": "coding",
  "phuryn/pm-skills": "business",
  "Graphify-Labs/graphify": "agent",
  "kxxwz/SJTU-Courses": "agent",
  "virgiliojr94/book-to-skill": "learning",
  "stablyai/orca": "coding",
  "redfox-data/redfox-community": "agent",
  "anywhere-labs/dsh-desktop": "assistant",
  "vikiboss/60s": "tools",
  "adongwanai/adong-skills": "agent",
  "adongwanai/AgentGuide": "learning",